name,states,designation,description,activities,phone_numbers,emails
Bering Land Bridge National Preserve,AK,National Preserve,Bering Land Bridge National Preserve lies at the continental crossroad that greatly influenced the distribution of life in the Western Hemisphere during the Pleistocene Epoch. It is a vital landscape for Indigenous communities who depend on the land just as their ancestors did for many generations. It is a wild and ecologically healthy landscape unlike any other.,"['Camping', 'Backcountry Camping', 'Dog Sledding', 'Flying', 'Fixed Wing Flying', 'Hiking', 'Backcountry Hiking', 'Hunting and Gathering', 'Gathering and Foraging', 'Junior Ranger Program', 'Snowmobiling', 'Wildlife Watching', 'Birdwatching']","['1-907-759-8020', '907-443-6139']",['bela_information@nps.gov']
Big Bend National Park,TX,National Park,"There is a place in Far West Texas where night skies are dark as coal and rivers carve temple-like canyons in ancient limestone. Here, at the end of the road, hundreds of bird species take refuge in a solitary mountain range surrounded by weather-beaten desert. Tenacious cactus bloom in sublime southwestern sun, and species diversity is the best in the country. This magical place is Big Bend...","['Auto and ATV', 'Scenic Driving', 'Astronomy', 'Stargazing', 'Biking', 'Camping', 'Backcountry Camping', 'Food', 'Guided Tours', 'Self-Guided Tours - Walking', 'Self-Guided Tours - Auto', 'Hiking', 'Backcountry Hiking', 'Front-Country Hiking', 'Paddling', 'Canoeing', 'Canoe or Kayak Camping', 'Kayaking', 'Junior Ranger Program', 'Wildlife Watching', 'Birdwatching', 'Park Film', 'Shopping', 'Bookstore and Park Store']",['432-477-2251'],['bibe_info@nps.gov']
Big Cypress National Preserve,FL,National Preserve,"The freshwaters of the Big Cypress Swamp, essential to the health of the neighboring Everglades, support the rich marine estuaries along Florida's southwest coast. Conserving over 729,000 acres of this vast swamp, Big Cypress National Preserve contains a mixture of tropical and temperate plant communities that are home to diverse wildlife, including the Endangered Florida panther.","['Arts and Culture', 'Auto and ATV', 'ATV Off-Roading', 'Scenic Driving', 'Astronomy', 'Stargazing', 'Biking', 'Road Biking', 'Boating', 'Boat Tour', 'Camping', 'Backcountry Camping', 'Car or Front Country Camping', 'Group Camping', 'RV Camping', 'Food', 'Picnicking', 'Guided Tours', 'Boat Tour', 'Hiking', 'Backcountry Hiking', 'Front-Country Hiking', 'Hunting and Gathering', 'Hunting', 'Paddling', 'Canoeing', 'Kayaking', 'Junior Ranger Program', 'Wildlife Watching', 'Birdwatching', 'Park Film', 'Museum Exhibits', 'Shopping', 'Bookstore and Park Store']","['2396952000', '2396953901']",['bicy_information@nps.gov']
Big Hole National Battlefield,MT,National Battlefield,"On August 9, 1877, gunshots shattered a chilly dawn on a sleeping camp of nımí·pu· (Nez Perce). By the time the smoke cleared on August 10, almost 90 nımí·pu· were dead, along with 31 soldiers and volunteers. Big Hole National Battlefield was created to honor all who were there.","['Arts and Culture', 'Cultural Demonstrations', 'Fishing', 'Freshwater Fishing', 'Food', 'Picnicking', 'Guided Tours', 'Self-Guided Tours - Walking', 'Hiking', 'Front-Country Hiking', 'Junior Ranger Program', 'Skiing', 'Cross-Country Skiing', 'Snowshoeing', 'Wildlife Watching', 'Birdwatching', 'Park Film', 'Museum Exhibits', 'Shopping', 'Bookstore and Park Store', 'Gift Shop and Souvenirs']",['4066893155'],['biho_visitor_information@nps.gov']
Big South Fork National River & Recreation Area,"KY,TN",National River & Recreation Area,"Encompassing 125,000 acres of the Cumberland Plateau, Big South Fork National River and Recreation Area protects the free-flowing Big South Fork of the Cumberland River and its tributaries. The area boasts miles of scenic gorges and sandstone bluffs, is rich with natural and historic features and has been developed to provide visitors with a wide range of outdoor recreational activities.","['Arts and Culture', 'Astronomy', 'Stargazing', 'Biking', 'Mountain Biking', 'Boating', 'Camping', 'Backcountry Camping', 'Horse Camping (see also Horse/Stock Use)', 'RV Camping', 'Climbing', 'Rock Climbing', 'Fishing', 'Freshwater Fishing', 'Food', 'Picnicking', 'Hiking', 'Horse Trekking', 'Horseback Riding', 'Hunting and Gathering', 'Hunting', 'Paddling', 'Junior Ranger Program', 'Tubing', 'Swimming', 'Pool Swimming', 'Wildlife Watching', 'Birdwatching', 'Park Film', 'Shopping', 'Bookstore and Park Store']","['4235699778', '4235695505']",['biso_information@nps.gov']
Big Thicket National Preserve,TX,National Preserve,"Life of all types abounds in the Big Thicket. This national preserve protects the incredible diversity of life found where multiple habitats meet in southeast Texas. Hiking trails and waterways meander through nine different ecosystems, from longleaf pine forests to cypress-lined bayous. It is a place of discovery, a place to wander and explore, a place to marvel at the richness of nature.","['Biking', 'Boating', 'Camping', 'Backcountry Camping', 'Canoe or Kayak Camping', 'Fishing', 'Food', 'Picnicking', 'Hands-On', 'Citizen Science', 'Hiking', 'Hunting and Gathering', 'Hunting', 'Paddling', 'Canoeing', 'Canoe or Kayak Camping', 'Kayaking', 'Junior Ranger Program', 'Wildlife Watching', 'Birdwatching', 'Park Film', 'Shopping', 'Bookstore and Park Store', 'Gift Shop and Souvenirs']",['409-951-6700'],['bith_information@nps.gov']
Bighorn Canyon National Recreation Area,"MT,WY",National Recreation Area,"The vast, wild landscape of Bighorn Canyon National Recreation Area offers visitors unparalleled opportunities to immerse themselves in the natural world, and experience the wonders of this extraordinary place. With over 120,000 acres, one can find an astounding diversity in ecosystems, wildlife, and more than 10,000 years of human history to explore.","['Arts and Culture', 'Theater', 'Auto and ATV', 'Scenic Driving', 'Astronomy', 'Stargazing', 'Biking', 'Road Biking', 'Boating', 'Motorized Boating', 'Sailing', 'Jet Skiing', 'Boat Tour', 'Camping', 'Compass and GPS', 'Fishing', 'Freshwater Fishing', 'Fly Fishing', 'Food', 'Dining', 'Picnicking', 'Guided Tours', 'Self-Guided Tours - Walking', 'Boat Tour', 'Hiking', 'Front-Country Hiking', 'Off-Trail Permitted Hiking', 'Hunting and Gathering', 'Hunting', 'Paddling', 'Canoeing', 'Canoe or Kayak Camping', 'Kayaking', 'Stand Up Paddleboarding', 'Junior Ranger Program', 'Playground', 'Skiing', 'Cross-Country Skiing', 'Snow Play', 'Snowshoeing', 'Swimming', 'Freshwater Swimming', 'Wildlife Watching', 'Birdwatching', 'Park Film', 'Museum Exhibits', 'Shopping', 'Bookstore and Park Store']",['3075485406'],['BICA_media@nps.gov']
Birmingham Civil Rights National Monument,AL,National Monument,"In 1963, images of snarling police dogs unleashed against non-violent protesters and of children being sprayed with high-pressure hoses appeared in print and television news around the world. These dramatic scenes of violent police aggression against civil rights protesters in Birmingham, Alabama were vivid examples of segregation and racial injustice in America.","['Guided Tours', 'Self-Guided Tours - Walking', 'Museum Exhibits']",['205-679-0065'],['bicr_information@nps.gov']
Biscayne National Park,FL,National Park,"Within sight of Miami, yet worlds away, Biscayne protects a rare combination of aquamarine waters, emerald islands, and fish-bejeweled coral reefs. Evidence of 10,000 years of human history is here too; from prehistoric tribes to shipwrecks, and pineapple farmers to presidents. For many, the park is a boating, fishing, and diving destination, while others enjoy a warm breeze and peaceful scenery.","['Boating', 'Motorized Boating', 'Sailing', 'Boat Tour', 'Camping', 'Fishing', 'Guided Tours', 'Boat Tour', 'Paddling', 'Canoeing', 'Kayaking', 'Stand Up Paddleboarding', 'Junior Ranger Program', 'SCUBA Diving', 'Snorkeling', 'Swimming', 'Saltwater Swimming', 'Wildlife Watching', 'Birdwatching', 'Park Film', 'Museum Exhibits', 'Shopping', 'Bookstore and Park Store', 'Gift Shop and Souvenirs']",['786-335-3620'],['bisc_information@nps.gov']
Black Canyon Of The Gunnison National Park,CO,National Park,"Big enough to be overwhelming, yet still intimate enough to feel the pulse of time. Come see some of the steepest cliffs, oldest rock, and craggiest spires in North America. Forces of nature and the Gunnison River sculpted this canyon over two million years. The result is a vertical wilderness of rock, water, and sky.","['Astronomy', 'Stargazing', 'Camping', 'Backcountry Camping', 'Car or Front Country Camping', 'RV Camping', 'Climbing', 'Rock Climbing', 'Fishing', 'Fly Fishing', 'Hiking', 'Backcountry Hiking', 'Front-Country Hiking', 'Horse Trekking', 'Horseback Riding', 'Paddling', 'Kayaking', 'Junior Ranger Program', 'Skiing', 'Cross-Country Skiing', 'Snowshoeing', 'Wildlife Watching', 'Birdwatching', 'Park Film', 'Shopping', 'Bookstore and Park Store']",['970-641-2337'],['blca_info@nps.gov']
Blackstone River Valley National Historical Park,"RI,MA",National Historical Park,"The Blackstone River powered America's entry into the Age of Industry. The success of Samuel Slater's cotton spinning mill in Pawtucket, RI touched off a chain reaction that changed how people worked and where they lived. Learn how this revolution transformed the landscape of the Blackstone Valley and the United States. The Visitor Center at Old Slater Mill is closed for the winter season.","['Biking', 'Fishing', 'Food', 'Dining', 'Picnicking', 'Guided Tours', 'Self-Guided Tours - Walking', 'Paddling', 'Canoeing', 'Kayaking', 'Junior Ranger Program', 'Wildlife Watching', 'Birdwatching']",['(401) 725-8638'],['allison_horrocks@nps.gov']
Blackwell School National Historic Site,TX,National Historic Site,"Written by prejudice rather than law, the story of the Blackwell School is one of “separate but equal” education for Mexican and Mexican American citizens of Marfa, Texas. Built in 1909, the school serves as a significant example of how racism and cultural disparity dominated education and social systems in the United States during this period of de facto segregation from 1889-1965.",[],[],['Blackwell_school_visitor_information@nps.gov']
Blue Ridge Parkway,"NC,VA",Parkway,"A Blue Ridge Parkway experience is unlike any other: a slow-paced and relaxing drive revealing stunning long-range vistas and close-up views of the rugged mountains and pastoral landscapes of the Appalachian Highlands. The Parkway meanders for 469 miles, protecting a diversity of plants and animals, and providing opportunities for enjoying all that makes this region of the country so special.","['Arts and Culture', 'Live Music', 'Auto and ATV', 'Scenic Driving', 'Biking', 'Road Biking', 'Camping', 'Car or Front Country Camping', 'Fishing', 'Freshwater Fishing', 'Food', 'Picnicking', 'Hiking', 'Backcountry Hiking', 'Front-Country Hiking', 'Junior Ranger Program', 'Wildlife Watching', 'Shopping', 'Bookstore and Park Store']",['8283483400'],['blri_info@nps.gov']
Bluestone National Scenic River,WV,National Scenic River,The Bluestone River and the rugged and ancient gorge it has carved is a richly diverse and scenic area of the southern Appalachians. Bluestone National Scenic River is preserved as a living landscape that provides an unspoiled experience for visitors and a haven for a variety of plants and animals. The park protects a 10.5-mile section of the Bluestone River in southern West Virginia.,"['Biking', 'Mountain Biking', 'Boating', 'Fishing', 'Freshwater Fishing', 'Guided Tours', 'Hiking', 'Hunting and Gathering', 'Hunting', 'Paddling', 'Canoeing', 'Kayaking', 'Junior Ranger Program', 'Wildlife Watching', 'Birdwatching']","['304-465-0508', '304-465-0591']",['neri_interpretation@nps.gov']
Booker T Washington National Monument,VA,National Monument,"Booker T. Washington was born a slave in April 1856 on the 207-acre farm of James Burroughs. After the Civil War, Washington became the first principal of Tuskegee Normal and Industrial School. Later as an adviser, author and orator, his past would influence his philosophies as the most influential African American of his era. Come explore his birthplace.","['Arts and Culture', 'Craft Demonstrations', 'Cultural Demonstrations', 'Live Music', 'Food', 'Picnicking', 'Guided Tours', 'Self-Guided Tours - Walking', 'Hiking', 'Living History', 'Reenactments', 'Junior Ranger Program', 'Park Film', 'Museum Exhibits']","['5406820173', '5407215128']",['bowa_rangers_3@nps.gov']
Boston African American National Historic Site,MA,National Historic Site,"Centered on the north slope of Beacon Hill, the African American community of 1800s Boston led the city and the nation in the fight against slavery and injustice. These remarkable men and women, together with their allies, were leaders in the Abolition Movement, the Underground Railroad, the Civil War, and the early struggle for equal rights and education.","['Guided Tours', 'Self-Guided Tours - Walking', 'Junior Ranger Program', 'Museum Exhibits']",['6174296760'],['boaf_mail@nps.gov']
