name,states,designation,description,activities,phone_numbers,emails
Abraham Lincoln Birthplace National Historical Park,KY,National Historical Park,"For over a century people from around the world have come to rural Central Kentucky to honor the humble beginnings of our 16th president, Abraham Lincoln. His early life on Kentucky's frontier shaped his character and prepared him to lead the nation through Civil War. Visit our country's first memorial to Lincoln, built with donations from young and old, and the site of his childhood home.","['Astronomy', 'Stargazing', 'Food', 'Picnicking', 'Guided Tours', 'Self-Guided Tours - Walking', 'Hands-On', 'Junior Ranger Program', 'Wildlife Watching', 'Birdwatching', 'Park Film', 'Museum Exhibits', 'Shopping', 'Bookstore and Park Store', 'Gift Shop and Souvenirs']",['2703583137'],['ABLI_Administration@nps.gov']
Acadia National Park,ME,National Park,"Acadia National Park protects the natural beauty of the highest rocky headlands along the Atlantic coastline of the United States, an abundance of habitats, and a rich cultural heritage. At 4 million visits a year, it's one of the top 10 most-visited national parks in the United States. Visitors enjoy 27 miles of historic motor roads, 158 miles of hiking trails, and 45 miles of carriage roads.","['Arts and Culture', 'Cultural Demonstrations', 'Astronomy', 'Stargazing', 'Biking', 'Boating', 'Camping', 'Group Camping', 'Climbing', 'Rock Climbing', 'Compass and GPS', 'Geocaching', 'Fishing', 'Freshwater Fishing', 'Fly Fishing', 'Saltwater Fishing', 'Food', 'Picnicking', 'Guided Tours', 'Bus/Shuttle Guided Tour', 'Boat Tour', 'Hands-On', 'Citizen Science', 'Hiking', 'Front-Country Hiking', 'Horse Trekking', 'Horseback Riding', 'Ice Skating', 'Paddling', 'Canoeing', 'Kayaking', 'Stand Up Paddleboarding', 'Junior Ranger Program', 'Skiing', 'Cross-Country Skiing', 'Snow Play', 'Snowmobiling', 'Snowshoeing', 'Swimming', 'Freshwater Swimming', 'Saltwater Swimming', 'Wildlife Watching', 'Birdwatching', 'Park Film', 'Shopping', 'Bookstore and Park Store']","['2072883338', '2072888813', '2072888800']",['acadia_information@nps.gov']
Adams National Historical Park,MA,National Historical Park,"From the sweet little farm at the foot of Penn’s Hill to the gentleman’s country estate at Peace field, Adams National Historical Park is the story of “heroes, statesmen, philosophers…and learned women” whose ideas and actions helped to transform thirteen disparate colonies into one united nation.","['Guided Tours', 'Self-Guided Tours - Walking', 'Living History', 'First Person Interpretation', 'Junior Ranger Program', 'Park Film', 'Shopping', 'Bookstore and Park Store']",['617-770-1175'],['ADAM_Visitor_Center@nps.gov']
African American Civil War Memorial,DC,,"Over 200,000 African-American soldiers and sailors served in the U.S. Army and Navy during the Civil War. Their service helped to end the war and free over four million slaves. The African American Civil War Memorial honors their service and sacrifice.","['Guided Tours', 'Self-Guided Tours - Walking']",['2024266841'],['national_mall@nps.gov']
African Burial Ground National Monument,NY,National Monument,"The African Burial Ground stands as the oldest and largest known excavated burial site in North America for both free and enslaved Africans. It offers a profound testament to the enduring legacy of African communities whose labor, resilience, and cultural contributions were fundamental in shaping the development of New York.","['Arts and Culture', 'Guided Tours', 'Junior Ranger Program', 'Park Film', 'Museum Exhibits', 'Shopping', 'Bookstore and Park Store']",['2122384367'],['african_burial_ground@nps.gov']
Agate Fossil Beds National Monument,NE,National Monument,"In the early 1900s, paleontologists unearthed the Age of Mammals when they found full skeletons of extinct Miocene mammals in the hills of Nebraska -- species previously only known through fragments. At the same time, an age of friendship began between rancher James Cook and Chief Red Cloud of the Lakota. These two unprecedented events are preserved and protected here... at Agate Fossil Beds.","['Arts and Culture', 'Cultural Demonstrations', 'Astronomy', 'Stargazing', 'Food', 'Picnicking', 'Guided Tours', 'Self-Guided Tours - Walking', 'Hiking', 'Junior Ranger Program', 'Wildlife Watching', 'Birdwatching', 'Park Film', 'Museum Exhibits', 'Shopping', 'Bookstore and Park Store']","['3086654113', '3086654114']",['agfo_ranger_activities@nps.gov']
Ala Kahakai National Historic Trail,HI,National Historic Trail,"Established in 2000 to preserve, protect and interpret traditional Native Hawaiian culture and natural resources, Ala Kahakai National Historic Trail is a 175-mile corridor encompassing a network of culturally and historically significant trails. This ""trail by the sea"" traverses wahi pana (storied landscapes), ancient Hawaiian sites and over 200 ahupuaʻa (traditional land divisions).","['Arts and Culture', 'Cultural Demonstrations', 'Auto and ATV', 'Scenic Driving', 'Biking', 'Mountain Biking', 'Road Biking', 'Boating', 'Motorized Boating', 'Sailing', 'Boat Tour', 'Camping', 'Canoe or Kayak Camping', 'Car or Front Country Camping', 'Group Camping', 'RV Camping', 'Compass and GPS', 'Geocaching', 'Orienteering', 'Fishing', 'Saltwater Fishing', 'Food', 'Picnicking', 'Guided Tours', 'Self-Guided Tours - Walking', 'Self-Guided Tours - Auto', 'Hands-On', 'Arts and Crafts', 'Hiking', 'Front-Country Hiking', 'Paddling', 'Canoeing', 'Canoe or Kayak Camping', 'Kayaking', 'Stand Up Paddleboarding', 'Junior Ranger Program', 'SCUBA Diving', 'Snorkeling', 'Surfing', 'Swimming', 'Saltwater Swimming', 'Wildlife Watching', 'Birdwatching']",[],['aric_arakaki@nps.gov']
Alagnak Wild River,AK,Wild River,"The headwaters of Alagnak Wild River lie within the rugged Aleutian Range of neighboring Katmai National Park and Preserve. Meandering west towards Bristol Bay and the Bering Sea, the Alagnak traverses the beautiful Alaska Peninsula, providing an unparalleled opportunity to experience the unique wilderness, wildlife, and cultural heritage of southwest Alaska.","['Boating', 'Camping', 'Backcountry Camping', 'Fishing', 'Hunting and Gathering', 'Hunting', 'Paddling', 'Canoe or Kayak Camping', 'Kayaking', 'Whitewater Rafting', 'Wildlife Watching', 'Birdwatching']",['9072463305'],['KATM_Visitor_Information@nps.gov']
Alaska Public Lands,AK,,"Alaska’s parks, forests, and refuges are rich and varied. The Alaska Public Lands Information Centers help visitors and residents to have meaningful, safe, enjoyable experiences on public lands, and encourages them to sustain the natural and cultural resources of Alaska. These centers provide trip-planning, interpretation, and education for all ages.",[],"['9076443661', '9072712744', '8668696887']",['anch_web_mail@nps.gov']
Alcatraz Island,CA,,"Alcatraz reveals stories of American incarceration, justice, and our common humanity. This small island was once a fort, a military prison, and a maximum security federal penitentiary. In 1969, the Indians of All Tribes occupied Alcatraz for 19 months in the name of freedom and Native American civil rights. We invite you to explore Alcatraz's complex history and natural beauty.","['Food', 'Wildlife Watching', 'Birdwatching', 'Museum Exhibits', 'Shopping', 'Bookstore and Park Store']",['415-561-4900'],['goga_alca_socialmedia@nps.gov']
Aleutian Islands World War II National Historic Area,AK,National Historic Area,"The remote Aleutian Islands, home to the Unangax̂ (Aleut) people for over 8,000 years, became a fiercely contested Pacific battleground in World War II. Some Unangax̂ were taken from their homelands as Japanese prisoners of war while the others were evacuated from the islands by the government. Both groups suffered greatly during the war, and some would never return to their villages.","['Guided Tours', 'Self-Guided Tours - Walking', 'Self-Guided Tours - Auto', 'Junior Ranger Program', 'Wildlife Watching', 'Birdwatching', 'Museum Exhibits']",['907-581-9944'],['anch_web_mail@nps.gov']
Alibates Flint Quarries National Monument,TX,National Monument,"13,000 years ago, Alibates Flint was used by mammoth hunters as a source of flint for tools. Learn how important this site was to the survival, commerce, and culture of the people of the High Plains.","['Arts and Culture', 'Craft Demonstrations', 'Camping', 'Guided Tours', 'Junior Ranger Program', 'Park Film', 'Museum Exhibits']",['8068576680'],['lamr_interpretation@nps.gov']
Allegheny Portage Railroad National Historic Site,PA,National Historic Site,"The first railroad to cross the Allegheny Mountains, the Allegheny Portage Railroad was the final piece of the Pennsylvania Main Line Canal. ""The Portage"" opened in 1834, marking the first time that there was one, direct route between Philadelphia and Pittsburgh. All things to all people, it served merchants, passengers, slaves in pursuit of freedom, and soldiers from the Mexican War.","['Arts and Culture', 'Cultural Demonstrations', 'Guided Tours', 'Self-Guided Tours - Walking', 'Hiking', 'Living History', 'Historic Weapons Demonstration', 'First Person Interpretation', 'Junior Ranger Program', 'Park Film', 'Museum Exhibits', 'Shopping', 'Bookstore and Park Store']",['8148866150'],['alpo_interpretation@nps.gov']
Amache National Historic Site,CO,National Historic Site,"Amache, also known as the Granada Relocation Center, near Granada, Colorado was one of ten incarceration sites established by the War Relocation Authority during World War II to unjustly incarcerate Japanese Americans. Over 10,000 people, most American citizens, were incarcerated at Amache from 1942 to 1945.","['Guided Tours', 'Self-Guided Tours - Auto', 'Junior Ranger Program']",['719-936-7600'],['Amache_visitor_information@nps.gov']
American Memorial Park,MP,Park,"American Memorial Park honors the American and Marianas people who gave their lives during the Marianas Campaign of World War II. At the park, memorials stand in tribute to the courage and sacrifice of the US Servicemen and Chamorro and Carolinian civilians who were killed in the battles between the United States and Japan that took place on Saipan, Tinian, and the Philippine Sea in 1944.","['Arts and Culture', 'Theater', 'Biking', 'Fishing', 'Saltwater Fishing', 'Food', 'Picnicking', 'Guided Tours', 'Self-Guided Tours - Walking', 'Living History', 'First Person Interpretation', 'Junior Ranger Program', 'Surfing', 'Swimming', 'Saltwater Swimming', 'Wildlife Watching', 'Birdwatching', 'Park Film', 'Museum Exhibits', 'Shopping', 'Bookstore and Park Store', 'Gift Shop and Souvenirs']",['6702347207'],['brooke_nevitt@nps.gov']
Amistad National Recreation Area,TX,National Recreation Area,"An oasis in the desert, Amistad National Recreation Area consists of the US portion of the International Amistad Reservoir. Amistad, a Spanish word meaning ""friendship,"" is known for excellent water-based recreation, camping, hiking, and rich cultural history dating back nearly 5,000 years. Amistad is also home to a wide variety of plant and animal life both above and below the water.","['Boating', 'Motorized Boating', 'Sailing', 'Jet Skiing', 'Camping', 'Backcountry Camping', 'Canoe or Kayak Camping', 'Car or Front Country Camping', 'Group Camping', 'RV Camping', 'Fishing', 'Freshwater Fishing', 'Hiking', 'Front-Country Hiking', 'Hunting and Gathering', 'Hunting', 'Paddling', 'Canoeing', 'Kayaking', 'Junior Ranger Program', 'SCUBA Diving', 'Swimming', 'Freshwater Swimming', 'Water Skiing', 'Wildlife Watching', 'Birdwatching', 'Park Film', 'Shopping', 'Bookstore and Park Store']","['(830) 775-7491', '(830) 778-9248']",['amis_interpretation@nps.gov']
Anacostia Park,DC,Park,"Welcome to Anacostia Park, your neighborhood national park in the heart of Washington, DC! Enjoy exercise along the river trail or relax by the water, Anacostia Park is a breath of fresh air and a space to unwind amid a bustling city.","['Biking', 'Road Biking', 'Boating', 'Fishing', 'Freshwater Fishing', 'Food', 'Picnicking', 'Guided Tours', 'Self-Guided Tours - Walking', 'Paddling', 'Canoeing', 'Kayaking', 'Playground', 'Team Sports', 'Wildlife Watching']",['771-208-1571'],['anac_visitorservices@nps.gov']
Andersonville National Historic Site,GA,National Historic Site,"Nearly 13,000 men died on these grounds, a site that became infamous even before the Civil War ended. Their burial grounds became Andersonville National Cemetery, where veterans continue to be buried today. This place, where tens of thousands suffered captivity so others could be free, is also home to the National Prisoner of War Museum and serves as a memorial to all American prisoners of war.","['Auto and ATV', 'Scenic Driving', 'Camping', 'Group Camping', 'Food', 'Picnicking', 'Guided Tours', 'Self-Guided Tours - Walking', 'Self-Guided Tours - Auto', 'Living History', 'Reenactments', 'Historic Weapons Demonstration', 'First Person Interpretation', 'Junior Ranger Program', 'Park Film', 'Museum Exhibits', 'Shopping', 'Bookstore and Park Store', 'Gift Shop and Souvenirs']",['2299240343'],['ande_information@nps.gov']
Andrew Johnson National Historic Site,TN,National Historic Site,"Andrew Johnson's complex presidency (1865-69) illustrates the Constitution at work following the Civil War. As the President and Congress disagreed on Reconstruction methods, the Constitution served as their guide on balance of powers, vetoes, and impeachment. In the end, it evolved as a living document with pivotal amendments on freedom, citizenship, and voting rights - topics still vital today.","['Arts and Culture', 'Guided Tours', 'Self-Guided Tours - Walking', 'Junior Ranger Program', 'Museum Exhibits']","['4236383551', '4237980754']",['anjo_information@nps.gov']
Aniakchak National Monument & Preserve,AK,National Monument & Preserve,"Given its remote location and challenging weather conditions, Aniakchak is one of the most wild and least visited places in the National Park System. This landscape is a vibrant reminder of Alaska's location in the volcanically active ""Ring of Fire,"" as it is home to an impressive six mile (10 km) wide, 2,500 ft (762 m) deep caldera formed during a massive volcanic eruption 3,500 years ago.","['Camping', 'Backcountry Camping', 'Climbing', 'Mountain Climbing', 'Flying', 'Hiking', 'Backcountry Hiking', 'Paddling', 'Whitewater Rafting', 'Wildlife Watching', 'Birdwatching']",['9072463305'],['KATM_Visitor_Information@nps.gov']
Antietam National Battlefield,MD,National Battlefield,"23,000 soldiers were killed, wounded or missing after twelve hours of savage combat on September 17, 1862. The Battle of Antietam ended the Confederate Army of Northern Virginia's first invasion into the North and led Abraham Lincoln to issue the preliminary Emancipation Proclamation.","['Biking', 'Road Biking', 'Camping', 'Group Camping', 'Guided Tours', 'Self-Guided Tours - Walking', 'Self-Guided Tours - Auto', 'Hiking', 'Living History', 'Historic Weapons Demonstration', 'Junior Ranger Program', 'Wildlife Watching', 'Birdwatching', 'Park Film', 'Museum Exhibits', 'Shopping', 'Bookstore and Park Store']",['3014325124'],['anti_info@nps.gov']
Apostle Islands National Lakeshore,WI,National Lakeshore,"Apostle Islands National Lakeshore, located at the northern tip of Wisconsin's Bayfield Peninsula, features 21 stunning islands, a scenic 12-mile shoreline along Lake Superior, and is located within the ancestral homeland of the Ojibwe people. Established in 1970, the park showcases picturesque sea caves, sandy beaches, and the largest collection of lighthouses in the National Park system.","['Boating', 'Motorized Boating', 'Sailing', 'Boat Tour', 'Camping', 'Backcountry Camping', 'Canoe or Kayak Camping', 'Group Camping', 'Fishing', 'Freshwater Fishing', 'Guided Tours', 'Boat Tour', 'Hiking', 'Hunting and Gathering', 'Hunting', 'Paddling', 'Canoe or Kayak Camping', 'Kayaking', 'Junior Ranger Program', 'SCUBA Diving', 'Snowshoeing', 'Swimming', 'Freshwater Swimming', 'Wildlife Watching', 'Birdwatching', 'Park Film', 'Shopping', 'Bookstore and Park Store', 'Gift Shop and Souvenirs']","['7157793397', '7157793049']",['apis_information@nps.gov']
Appalachian National Scenic Trail,"CT,GA,MA,MD,ME,NC,NH,NJ,NY,PA,TN,VA,VT,WV",National Scenic Trail,"The Appalachian Trail is a 2,190+ mile long public footpath that traverses the scenic, wooded, pastoral, wild, and culturally resonant lands of the Appalachian Mountains. Conceived in 1921, built by private citizens, and completed in 1937, today the trail is managed by the National Park Service, US Forest Service, Appalachian Trail Conservancy, numerous state agencies and thousands of volunteers.","['Astronomy', 'Stargazing', 'Camping', 'Backcountry Camping', 'Compass and GPS', 'Orienteering', 'Guided Tours', 'Self-Guided Tours - Walking', 'Hands-On', 'Citizen Science', 'Volunteer Vacation', 'Hiking', 'Backcountry Hiking', 'Front-Country Hiking', 'Junior Ranger Program', 'Snowshoeing', 'Wildlife Watching', 'Birdwatching']",['3045356278'],['0@0']
Appomattox Court House National Historical Park,VA,National Historical Park,"On April 9, 1865, the surrender of the Army of Northern Virginia in the McLean House in the village of Appomattox Court House, Virginia signaled the effective end of the nation's largest war. Questions remained: could the nation reunite as one? How would emancipation be realized?","['Arts and Culture', 'Cultural Demonstrations', 'Auto and ATV', 'Scenic Driving', 'Food', 'Picnicking', 'Guided Tours', 'Hiking', 'Living History', 'Historic Weapons Demonstration', 'First Person Interpretation', 'Junior Ranger Program', 'Wildlife Watching', 'Birdwatching', 'Park Film', 'Museum Exhibits', 'Shopping', 'Bookstore and Park Store', 'Gift Shop and Souvenirs']",['4346948904'],['APCO_SocialMedia@nps.gov']
Arches National Park,UT,National Park,"Discover a landscape of contrasting colors, land forms, and textures unlike any other. The park has over 2,000 natural stone arches, hundreds of soaring pinnacles, massive rock fins, and giant balanced rocks. This red-rock wonderland will amaze you with its formations, refresh you with its trails, and inspire you with its sunsets.","['Arts and Culture', 'Astronomy', 'Stargazing', 'Biking', 'Camping', 'Backcountry Camping', 'Car or Front Country Camping', 'Group Camping', 'Canyoneering', 'Climbing', 'Rock Climbing', 'Guided Tours', 'Hiking', 'Horse Trekking', 'Horseback Riding', 'Junior Ranger Program', 'Shopping', 'Bookstore and Park Store']",['4357192299'],['archinfo@nps.gov']
Arkansas Post National Memorial,AR,National Memorial,"Located at the confluence of two rivers, Arkansas Post has served as a gathering place for many cultures throughout human history - it represents cultural cooperation, conflict, synthesis, and diversity.","['Arts and Culture', 'Cultural Demonstrations', 'Boating', 'Fishing', 'Freshwater Fishing', 'Food', 'Picnicking', 'Guided Tours', 'Self-Guided Tours - Walking', 'Hiking', 'Front-Country Hiking', 'Living History', 'Historic Weapons Demonstration', 'First Person Interpretation', 'Paddling', 'Canoeing', 'Kayaking', 'Junior Ranger Program', 'Wildlife Watching', 'Birdwatching', 'Park Film', 'Museum Exhibits', 'Shopping', 'Bookstore and Park Store', 'Gift Shop and Souvenirs']",['8705482207'],['arpo_information@nps.gov']
"Arlington House, The Robert E. Lee Memorial",VA,,"Arlington House is the nation’s memorial to Robert E. Lee. It honors him for specific reasons, including his role in promoting peace and reunion after the Civil War. In a larger sense it exists as a place of study and contemplation of the meaning of some of the most difficult aspects of American history: military service; sacrifice; citizenship; duty; loyalty; slavery and freedom.","['Guided Tours', 'Self-Guided Tours - Walking', 'Museum Exhibits']",['7032351530'],['gwmp_superintendent@nps.gov']
Assateague Island National Seashore,"MD,VA",National Seashore,"Want to live on the edge? Visit a place recreated each day by ocean wind and waves. Life on Assateague Island has adapted to an existence on the move. Explore sandy beaches, salt marshes, maritime forests and coastal bays. Rest, relax, recreate and enjoy some time on the edge of the continent.","['Arts and Culture', 'Auto and ATV', 'Auto Off-Roading', 'Astronomy', 'Stargazing', 'Biking', 'Camping', 'Backcountry Camping', 'Canoe or Kayak Camping', 'Car or Front Country Camping', 'Horse Camping (see also Horse/Stock Use)', 'Group Camping', 'RV Camping', 'Compass and GPS', 'Geocaching', 'Fishing', 'Saltwater Fishing', 'Guided Tours', 'Hiking', 'Backcountry Hiking', 'Front-Country Hiking', 'Off-Trail Permitted Hiking', 'Horse Trekking', 'Horse Camping (see also camping)', 'Horseback Riding', 'Hunting and Gathering', 'Hunting', 'Paddling', 'Canoeing', 'Canoe or Kayak Camping', 'Kayaking', 'Stand Up Paddleboarding', 'Junior Ranger Program', 'Surfing', 'Swimming', 'Saltwater Swimming', 'Wildlife Watching', 'Birdwatching', 'Park Film', 'Shopping', 'Bookstore and Park Store']","['4106411441', '4106411099']",['asis_information@nps.gov']
Aztec Ruins National Monument,NM,National Monument,"Aztec Ruins has some of the best-preserved Chacoan structures of its kind. Learn more about the ancestral Pueblo people in the park's museum and explore the Aztec West great house to see exceptionally advanced architecture, original wooden beams, and a restored Great Kiva. Aztec Ruins is a deeply sacred place to many Indigenous peoples across the American Southwest. Please visit with respect.","['Arts and Culture', 'Cultural Demonstrations', 'Guided Tours', 'Self-Guided Tours - Walking', 'Hiking', 'Front-Country Hiking', 'Junior Ranger Program', 'Park Film', 'Museum Exhibits', 'Shopping', 'Bookstore and Park Store']","['5053346174', '5053346372']",['azru_information@nps.gov']
Badlands National Park,SD,National Park,"The rugged beauty of the Badlands draws visitors from around the world. These striking geologic deposits contain one of the world’s richest fossil beds. Ancient horses and rhinos once roamed here. The park’s 244,000 acres protect an expanse of mixed-grass prairie where bison, bighorn sheep, prairie dogs, and black-footed ferrets live today.","['Auto and ATV', 'Scenic Driving', 'Astronomy', 'Biking', 'Camping', 'Backcountry Camping', 'Car or Front Country Camping', 'Horse Camping (see also Horse/Stock Use)', 'Compass and GPS', 'Food', 'Hiking', 'Horse Trekking', 'Horse Camping (see also camping)', 'Horseback Riding', 'Junior Ranger Program', 'Wildlife Watching', 'Birdwatching', 'Park Film', 'Shopping', 'Bookstore and Park Store', 'Gift Shop and Souvenirs']",['6054335361'],['badl_information@nps.gov']
Baltimore-Washington Parkway,MD,Parkway,"This 29-mile highway connects Baltimore, MD and Washington, D.C. The parkway has carried visitors to and from the capital city since 1954.","['Auto and ATV', 'Scenic Driving']",['771-208-1453'],['nace_superintendent@nps.gov']
Bandelier National Monument,NM,National Monument,"Bandelier National Monument protects over 33,000 acres of ruggedly beautiful canyon and mesa country. Petroglyphs, dwellings carved into the soft rock cliffs, and standing masonry walls pay tribute to the early days of a culture that still survives in the surrounding communities.","['Arts and Culture', 'Craft Demonstrations', 'Cultural Demonstrations', 'Astronomy', 'Stargazing', 'Camping', 'Backcountry Camping', 'Car or Front Country Camping', 'Group Camping', 'Food', 'Dining', 'Picnicking', 'Guided Tours', 'Self-Guided Tours - Walking', 'Hiking', 'Backcountry Hiking', 'Front-Country Hiking', 'Junior Ranger Program', 'Skiing', 'Cross-Country Skiing', 'Snowshoeing', 'Wildlife Watching', 'Birdwatching', 'Park Film', 'Museum Exhibits', 'Shopping', 'Bookstore and Park Store', 'Gift Shop and Souvenirs']","['5056723861', '5056729607']",['band_visitor_center@nps.gov']
Belmont-Paul Women's Equality National Monument,DC,National Monument,"Home to the National Woman's Party for more than 90 years, this was the epicenter of the struggle for women's rights. From this house in the shadow of the U.S. Capitol and Supreme Court, Alice Paul and the NWP developed innovative strategies and tactics to advocate for the Equal Rights Amendment and equality for women. President Barack Obama designated the national monument on April 12, 2016.","['Guided Tours', 'Self-Guided Tours - Walking', 'Junior Ranger Program', 'Museum Exhibits', 'Shopping', 'Bookstore and Park Store', 'Gift Shop and Souvenirs']",['202-999-9999'],['bepa_info@nps.gov']
Bent's Old Fort National Historic Site,CO,National Historic Site,"In the 1840s the Arkansas River was the border between territory claimed by the United States and Mexico. Located along the river, Bent's Fort was an adobe trading post on the Santa Fe Trail, where traders, trappers, travelers, and the Cheyenne and Arapaho tribes came together in peaceful terms for trade. Today, a reconstructed fort allows visitors to explore the front line of Westward Expansion.","['Arts and Culture', 'Craft Demonstrations', 'Cultural Demonstrations', 'Biking', 'Road Biking', 'Guided Tours', 'Self-Guided Tours - Walking', 'Hiking', 'Living History', 'Junior Ranger Program', 'Wildlife Watching', 'Birdwatching', 'Park Film', 'Museum Exhibits', 'Shopping', 'Bookstore and Park Store', 'Gift Shop and Souvenirs']",['719 383-5010'],['beol_interpretation@nps.gov']
